{
  "$schema": "./schema.json",
  "grade": "6kyu",
  "term": {
    "kanji": "6級昇級考試実施要目",
    "romaji": "rokkyū shōkyū kōshi jisshi yōmoku"
  },
  "title": {
    "sv": "Ämnen för graderingstest till rokkyū (6 kyū)"
  },
  "sections": [
    {
      "marker": "◎",
      "term": { "kanji": "学科科目", "romaji": "gakka kamoku" },
      "title": { "sv": "teoretiska ämnen" },
      "items": [
        {
          "numbering": { "style": "bullet" },
          "term": {
            "kanji": "受験者が提出する宿題",
            "romaji": "jukensha ga teishutsu suru shukudai"
          },
          "text": { "sv": "Hemarbete att lämna in" },
          "items": [
            {
              "numbering": { "style": "paren", "value": 1 },
              "term": {
                "kanji": "少林寺拳法の創始の動機と目的",
                "romaji": "shōrinji kempō no sōshi no dōki to mokuteki"
              },
              "text": { "sv": "Motivation och mål med grundandet av Shorinji Kempo" }
            },
            {
              "numbering": { "style": "paren", "value": 2 },
              "term": {
                "kanji": "道場での心得",
                "romaji": "dōjō de no kokoroe"
              },
              "text": { "sv": "Riktlinjer för uppförande i dōjō" }
            }
          ]
        }
      ]
    },
    {
      "marker": "◎",
      "term": { "kanji": "技術科目", "romaji": "gijutsu kamoku" },
      "title": { "sv": "tekniska ämnen" },
      "items": [
        {
          "numbering": { "style": "numeric", "value": 1 },
          "term": { "kanji": "技術 I", "romaji": "gijutsu I" },
          "points": 100,
          "items": [
            {
              "numbering": { "style": "paren", "value": 1 },
              "term": {
                "kanji": "礼式、作法",
                "romaji": "rei shiki, sahō",
                "gloss": { "sv": "etikett, uppförande" }
              },
              "points": 60,
              "annotations": [
                {
                  "marker": "kome",
                  "text": { "sv": "Detta bedöms under hela graderingstestet, men kan bekräftas med specifika kommandon om nödvändigt." }
                }
              ],
              "techniqueGroups": [
                {
                  "techniques": [
                    { "kanji": "集合", "romaji": "shūgō" },
                    { "kanji": "整列", "romaji": "seiretsu" },
                    { "kanji": "座り方", "romaji": "suwari kata", "gloss": { "sv": "hur man sitter" } },
                    { "kanji": "立ち方", "romaji": "tachi kata", "gloss": { "sv": "hur man står" } },
                    { "kanji": "結手", "romaji": "kesshu" },
                    { "kanji": "合掌礼", "romaji": "gasshō rei" }
                  ]
                },
                {
                  "techniques": [
                    { "kanji": "調息", "romaji": "chōsoku" },
                    { "kanji": "八方目", "romaji": "happō moku" },
                    { "kanji": "服装", "romaji": "fukusō", "gloss": { "sv": "klädsel" } },
                    { "kanji": "態度", "romaji": "taido", "gloss": { "sv": "attityd" } },
                    { "kanji": "返事", "romaji": "henji", "gloss": { "sv": "hur man svarar" } },
                    { "kanji": "言葉", "romaji": "kotoba", "gloss": { "sv": "språk" } }
                  ]
                }
              ]
            },
            {
              "numbering": { "style": "paren", "value": 2 },
              "term": { "kanji": "体構え、布陣法", "romaji": "tai gamae, fujinhō" },
              "points": 10,
              "techniqueGroups": [
                {
                  "techniques": [
                    { "kanji": "中段構", "romaji": "chūdan gamae" },
                    { "kanji": "一字構", "romaji": "ichiji gamae" },
                    { "kanji": "対構", "romaji": "tai gamae" },
                    { "kanji": "開構", "romaji": "hiraki gamae" }
                  ]
                }
              ]
            },
            {
              "numbering": { "style": "paren", "value": 3 },
              "term": { "kanji": "全転換、半転換", "romaji": "zen tenkan, han tenkan" },
              "points": 10
            },
            {
              "numbering": { "style": "paren", "value": 4 },
              "term": { "kanji": "運歩法", "romaji": "umpohō" },
              "points": 10,
              "techniqueGroups": [
                {
                  "techniques": [
                    { "kanji": "千鳥足", "romaji": "chidori ashi" },
                    { "kanji": "蟹足", "romaji": "kani ashi" },
                    { "kanji": "十字足", "romaji": "jūji ashi" },
                    { "kanji": "蜘蛛足", "romaji": "kumo ashi" }
                  ]
                }
              ]
            },
            {
              "numbering": { "style": "paren", "value": 5 },
              "term": { "kanji": "受身", "romaji": "ukemi" },
              "points": 10,
              "techniqueGroups": [
                {
                  "techniques": [
                    { "kanji": "前受身", "romaji": "mae ukemi" },
                    { "kanji": "後受身", "romaji": "ushiro ukemi" },
                    { "kanji": "大車輪", "romaji": "dai sharin" },
                    { "kanji": "横転より起上り", "romaji": "ōten yori okiagari" }
                  ]
                }
              ]
            }
          ]
        },
        {
          "numbering": { "style": "numeric", "value": 2 },
          "term": { "kanji": "技術 II", "romaji": "gijutsu II" },
          "points": 100,
          "items": [
            {
              "numbering": { "style": "paren", "value": 1 },
              "term": { "kanji": "基本攻技", "romaji": "kihon kōgi" },
              "points": 20,
              "techniqueGroups": [
                {
                  "context": {
                    "kanji": "(開足立から)",
                    "text": { "sv": "(från kaisoku dachi)" }
                  },
                  "techniques": [
                    { "kanji": "目打", "romaji": "me uchi" },
                    { "kanji": "金的蹴", "romaji": "kinteki geri" },
                    { "kanji": "振子突", "romaji": "furiko zuki" },
                    { "kanji": "蹴上", "romaji": "keri age" }
                  ]
                },
                {
                  "context": {
                    "kanji": "(左、右前から)",
                    "text": { "sv": "(från hidari/migi mae)" }
                  },
                  "techniques": [
                    { "kanji": "順突", "romaji": "jun zuki" },
                    { "kanji": "逆突", "romaji": "gyaku zuki" },
                    { "kanji": "順蹴", "romaji": "jun geri" },
                    { "kanji": "逆蹴", "romaji": "gyaku geri" }
                  ]
                }
              ]
            },
            {
              "numbering": { "style": "paren", "value": 2 },
              "term": { "kanji": "基本防技", "romaji": "kihon bōgi" },
              "points": 20,
              "techniqueGroups": [
                {
                  "context": {
                    "kanji": "(開足立から)",
                    "text": { "sv": "(från kaisoku dachi)" }
                  },
                  "techniques": [
                    { "kanji": "上受", "romaji": "uwa uke" },
                    { "kanji": "内受", "romaji": "uchi uke" },
                    { "kanji": "下受", "romaji": "shita uke" },
                    { "kanji": "打払受", "romaji": "uchi harai uke" }
                  ]
                }
              ]
            },
            {
              "numbering": { "style": "paren", "value": 3 },
              "term": { "kanji": "移動攻技", "romaji": "idō kōgi" },
              "points": 10,
              "techniqueGroups": [
                {
                  "techniques": [
                    { "kanji": "前進突(順・逆)", "romaji": "zenshin zuki (jun, gyaku)" },
                    { "kanji": "前進蹴(順・逆)", "romaji": "zenshin geri (jun, gyaku)" }
                  ]
                }
              ]
            },
            {
              "numbering": { "style": "paren", "value": 4 },
              "term": { "kanji": "胴突、胴蹴", "romaji": "dō zuki, dō geri" },
              "points": 10,
              "annotations": [
                {
                  "marker": "kome",
                  "text": { "sv": "Utförs före eller efter hōkei när man använder bōgu (skydd)." }
                }
              ],
              "techniqueGroups": [
                {
                  "context": {
                    "kanji": "(開足立から)",
                    "text": { "sv": "(från kaisoku dachi)" }
                  },
                  "techniques": [
                    { "kanji": "振子突", "romaji": "furiko zuki" },
                    { "kanji": "蹴上", "romaji": "keri age" }
                  ]
                },
                {
                  "context": {
                    "kanji": "(左、右前から)",
                    "text": { "sv": "(från hidari/migi mae)" }
                  },
                  "techniques": [
                    { "kanji": "順突", "romaji": "jun zuki" },
                    { "kanji": "逆突", "romaji": "gyaku zuki" },
                    { "kanji": "順蹴", "romaji": "jun geri" },
                    { "kanji": "逆蹴", "romaji": "gyaku geri" }
                  ]
                }
              ]
            },
            {
              "numbering": { "style": "paren", "value": 5 },
              "term": {
                "kanji": "天地拳第一系 (単演、左・右)",
                "romaji": "tenchi ken dai ikkei (tan'en, hidari & migi)"
              },
              "points": 20
            },
            {
              "numbering": { "style": "paren", "value": 6 },
              "term": {
                "kanji": "龍王拳第一系 (単演、左・右)",
                "romaji": "ryūō ken dai ikkei (tan'en, hidari & migi)"
              },
              "points": 20,
              "annotations": [
                {
                  "marker": "kome",